{
  "schema_version": 1,
  "event_id": "0001-started",
  "timestamp_utc": "2026-09-09T13:18:32Z",
  "experiment_id": "E0",
  "campaign_id": "E0-R1",
  "run_id": "E0-R1-N008",
  "event_type": "RUN_STARTED",
  "actor_role": "IMPLEMENTER",
  "subject_sha": "e87202e7e5aaefd1243d9295264562f45b4fe9b6",
  "summary": "Frozen before execution: manifest.json + protocol.json + fixtures + tools committed at subject e87202e7e5aaefd1243d9295264562f45b4fe9b6; case E0-R1-N008 (family NEG): Терминальный HANDOFF_COMPLETED, за которым следует CONTINUATION_CHECKPOINT (терминал не последним) — обязан отвергаться Expected outcome is preregistered in protocol.json and was not changed after seeing any result. Synthetic software control; no physics content.",
  "command": "python -m harness.work_cli validate <fixture execution dir>",
  "exit_code": null,
  "artifact_refs": [
    "fixtures/negative/n008_terminal_not_last/execution/passport.json"
  ],
  "resource_usage": {},
  "scientific_outcome": null
}
