{
  "schema_version": 1,
  "event_id": "0002-run-completed",
  "timestamp_utc": "2026-09-09T13:45:36Z",
  "experiment_id": "E0",
  "campaign_id": "E0-R3",
  "run_id": "E0-R3-U002",
  "event_type": "RUN_COMPLETED",
  "actor_role": "IMPLEMENTER",
  "subject_sha": "6c366e0df4822d39572362356bc65279f5a762d1",
  "summary": "Control case E0-R3-U002 (family UNIT) executed mechanically by tools/e0_runner.py against frozen subject 6c366e0df4822d39572362356bc65279f5a762d1. Fixture bytes materialized from git blobs and digest-verified; validator/tool invoked as subprocess; observed exit code 0. The control itself executed to completion; expected-vs-observed comparison is in the analysis event.",
  "command": "C:\\Python311\\python.exe C:\\NanoLab\\nl2-001\\experiments\\evidence\\E0\\E0-R1\\tools\\units_check.py C:\\NanoLab\\scratch\\nl2-001\\E0-R3-U002\\units\\u002_wrong_20.json C:\\NanoLab\\scratch\\nl2-001\\E0-R3-U002\\units\\u002_wrong_293_15.json C:\\NanoLab\\scratch\\nl2-001\\E0-R3-U002\\units\\u002_wrong_0_29315.json C:\\NanoLab\\scratch\\nl2-001\\E0-R3-U002\\units\\u002_wrong_0_0978.json",
  "exit_code": 0,
  "artifact_refs": [
    "artifacts/case_record.json",
    "artifacts/stdout.txt",
    "artifacts/stderr.txt"
  ],
  "resource_usage": {
    "duration_seconds": 0.046,
    "cpu_class": "sub-second local CPU"
  },
  "scientific_outcome": null
}
