{
  "schema_version": 1,
  "event_id": "0001-started",
  "timestamp_utc": "2026-09-09T13:18:32Z",
  "experiment_id": "E0",
  "campaign_id": "E0-R1",
  "run_id": "E0-R1-N002",
  "event_type": "RUN_STARTED",
  "actor_role": "IMPLEMENTER",
  "subject_sha": "5a151f751f7d60c1902e43fa503efd9a6037b236",
  "summary": "Frozen before execution: manifest.json + protocol.json + fixtures + tools committed at subject 5a151f751f7d60c1902e43fa503efd9a6037b236; case E0-R1-N002 (family NEG): Обрезанный JSON (валидный префикс, разрыв внутри токена) в passport.json — обязан отвергаться fail-closed Expected outcome is preregistered in protocol.json and was not changed after seeing any result. Synthetic software control; no physics content.",
  "command": "python -m harness.work_cli validate <fixture execution dir>",
  "exit_code": null,
  "artifact_refs": [
    "fixtures/negative/n002_truncated_json/execution/passport.json"
  ],
  "resource_usage": {},
  "scientific_outcome": null
}
