{
  "schema_version": 1,
  "event_id": "0001-started",
  "timestamp_utc": "2026-09-09T13:18:32Z",
  "experiment_id": "E0",
  "campaign_id": "E0-R1",
  "run_id": "E0-R1-G002",
  "event_type": "RUN_STARTED",
  "actor_role": "IMPLEMENTER",
  "subject_sha": "e87202e7e5aaefd1243d9295264562f45b4fe9b6",
  "summary": "Frozen before execution: manifest.json + protocol.json + fixtures + tools committed at subject e87202e7e5aaefd1243d9295264562f45b4fe9b6; case E0-R1-G002 (family GEO): Нулевое плечо (A == B): угол обязан классифицироваться ANGLE_UNDEFINED без числового значения; нулевое расстояние обязано вернуться как 0.0, не NaN Expected outcome is preregistered in protocol.json and was not changed after seeing any result. Synthetic software control; no physics content.",
  "command": "python tools/geometry_check.py fixtures/geometry/g002_zero_axis.json",
  "exit_code": null,
  "artifact_refs": [
    "fixtures/geometry/g002_zero_axis.json"
  ],
  "resource_usage": {},
  "scientific_outcome": null
}
