{
  "schema_version": 1,
  "event_id": "0001-started",
  "timestamp_utc": "2026-09-09T17:05:00Z",
  "experiment_id": "E0",
  "campaign_id": "E0-R4",
  "run_id": "E0-R4-G003",
  "event_type": "RUN_STARTED",
  "actor_role": "IMPLEMENTER",
  "subject_sha": "ce477aad1e4a125c9e881fd9f6a741ec6d2fa876",
  "summary": "Frozen before execution: manifest.json + protocol.json + fixtures + tools committed at subject ce477aad1e4a125c9e881fd9f6a741ec6d2fa876; case E0-R4-G003 (family GEO): Контроль ориентации: angle(P; O, Q) = 60 градусов и angle(P; R, Q) = 120 градусов при развороте плеча — оба значения аналитические и заморожены до прогона; тихий перескок ветви запрещён Expected outcome is preregistered in protocol.json and was not changed after seeing any result. Synthetic software control; no physics content.",
  "command": "python tools/geometry_check.py fixtures/geometry/g003_orientation_flip.json",
  "exit_code": null,
  "artifact_refs": [
    "fixtures/geometry/g003_orientation_flip.json"
  ],
  "resource_usage": {},
  "scientific_outcome": null
}
