{
  "schema_version": 1,
  "event_id": "0001-started",
  "timestamp_utc": "2026-09-09T14:25:00Z",
  "experiment_id": "E0",
  "campaign_id": "E0-R2",
  "run_id": "E0-R2-N006",
  "event_type": "RUN_STARTED",
  "actor_role": "IMPLEMENTER",
  "subject_sha": "3a2d72bcd613289321608fb42b6b668d8224b5f0",
  "summary": "Frozen before execution: manifest.json + protocol.json + fixtures + tools committed at subject 3a2d72bcd613289321608fb42b6b668d8224b5f0; case E0-R2-N006 (family NEG): Артефакт-запись с sha256 'deadbeef', отрицательным size, чужим producer_run_id и 6-значным subject_sha — нарушенный provenance-контракт обязан отвергаться Expected outcome is preregistered in protocol.json and was not changed after seeing any result. Synthetic software control; no physics content.",
  "command": "python -m harness.experiment_cli validate <fixture run dir>",
  "exit_code": null,
  "artifact_refs": [
    "fixtures/negative/n006_bad_artifact_digest/run/manifest.json"
  ],
  "resource_usage": {},
  "scientific_outcome": null
}
