{
  "schema_version": 1,
  "event_id": "0002-run-completed",
  "timestamp_utc": "2026-09-09T13:53:02Z",
  "experiment_id": "E0",
  "campaign_id": "E0-R4",
  "run_id": "E0-R4-N002",
  "event_type": "RUN_COMPLETED",
  "actor_role": "IMPLEMENTER",
  "subject_sha": "ce477aad1e4a125c9e881fd9f6a741ec6d2fa876",
  "summary": "Control case E0-R4-N002 (family NEG) executed mechanically by tools/e0_runner.py against frozen subject ce477aad1e4a125c9e881fd9f6a741ec6d2fa876. Fixture bytes materialized from git blobs and digest-verified; validator/tool invoked as subprocess; observed exit code 1. The control itself executed to completion; expected-vs-observed comparison is in the analysis event.",
  "command": "C:\\Python311\\python.exe -m harness.work_cli validate C:\\NanoLab\\scratch\\nl2-001\\E0-R4-N002\\negative\\n002_truncated_json\\execution",
  "exit_code": 1,
  "artifact_refs": [
    "artifacts/case_record.json",
    "artifacts/stdout.txt",
    "artifacts/stderr.txt"
  ],
  "resource_usage": {
    "duration_seconds": 0.059369,
    "cpu_class": "sub-second local CPU"
  },
  "scientific_outcome": null
}
